{"schema_version":"landing-evidence@1","repository":"ed3c/agent-skills-repo","authority":{"default_branch":"main","completion_rule":"reachable-commit-plus-digested-paths-and-tests"},"work_items":[{"issue_number":2,"title":"Anchoring oracle checker CLI","status":"completed","evidence_level":"reachable_on_main","notes":"Delivered by merged PR #9.","landing":{"commit_sha":"4daeff69c36e5ff6e05c42184d8759ad87d2cf7a","pull_request":9,"changed_paths":["anchor_oracle/__init__.py","anchor_oracle/core.py","conftest.py","contracts/design-partner-commercial-evidence.schema.json","contracts/managed-execution-receipt.schema.json","contracts/qualification-cost-receipt.schema.json","contracts/qualification-receipt.schema.json","contracts/registry-snapshot.schema.json","contracts/release-evidence.schema.json","contracts/resolver-decision-receipt.schema.json","contracts/resolver-request.schema.json","contracts/resolver-response.schema.json","contracts/sandbox-case-receipt.schema.json","contracts/workload-identity-receipt.schema.json","openwiki/anchor-oracle-comparison.md","openwiki/qualification-pipeline.md","pyproject.toml","requirements.lock","scripts/anchor_oracle.py","scripts/skill_description_linter.py","skill_arena/__init__.py","skill_arena/core.py","skill_arena/skill_assets.py","skills/repo_wiki_verified/corpus.json","skills/repo_wiki_verified/manifest.json","skills/repo_wiki_verified/references/procedure.md","skills/repo_wiki_verified/skills.md","tests/fixtures/anchor_oracle/fixture_repo/data/notes.txt","tests/fixtures/anchor_oracle/fixture_repo/src/demo.py","tests/fixtures/anchor_oracle/wiki_good/architecture/overview.md","tests/fixtures/anchor_oracle/wiki_good/index.md","tests/fixtures/anchor_oracle/wiki_hollow/badfm.md","tests/fixtures/anchor_oracle/wiki_hollow/fabricated.md","tests/fixtures/anchor_oracle/wiki_hollow/missing.md","tests/fixtures/anchor_oracle/wiki_hollow/prose.md","tests/fixtures/repo_wiki_verified/public_fixture_provenance.json","tests/fixtures/repo_wiki_verified/public_fixture_subset/scripts/ablation_engine.py","tests/fixtures/repo_wiki_verified/public_fixture_subset/scripts/git_gate.py","tests/fixtures/repo_wiki_verified/public_fixture_subset/scripts/no_op_pruner.py","tests/fixtures/repo_wiki_verified/public_fixture_subset/scripts/no_ops_purger.py","tests/fixtures/repo_wiki_verified/public_fixture_subset/scripts/skill_description_linter.py","tests/fixtures/repo_wiki_verified/public_fixture_subset/scripts/sync_wiki_to_graph.py","tests/fixtures/repo_wiki_verified/public_fixture_subset/scripts/validate_commit_message.py","tests/fixtures/repo_wiki_verified/public_fixture_subset/scripts/validate_progressive_disclosure.py","tests/fixtures/repo_wiki_verified/public_fixture_subset/scripts/validate_skills_baseline.py","tests/fixtures/repo_wiki_verified/public_fixture_subset/skills/gemini_interactions/status.json","tests/test_anchor_oracle.py","tests/test_repo_wiki_verified_corpus.py"],"changed_paths_digest":"sha256:317382744003b55faf18172b00751b4544a8650d7c612a786101c7ae698aa819","test_evidence":{"source":"pull_request","commands":["python -m pytest tests","python scripts/anchor_oracle.py --selftest","python scripts/skill_description_linter.py"],"result_summary":"PR #9 reports 103 passed, 7 skipped, and one pre-existing molecular-lineage failure; anchor selftest and description linter passed.","independently_verified":false,"digest":"sha256:23d49f33f8e0ee4974db1a6e87d4aec20a7ea9769be3dc4dd240cbfcf37ac2fc"}}},{"issue_number":3,"title":"Sandbox executor walking skeleton","status":"pending","evidence_level":"missing","notes":"The prior short-SHA claim 2e5a0c7 is not resolvable in this repository and no executor implementation is reachable from main. Issue remains open until a reviewable landing exists."},{"issue_number":4,"title":"First native skill and public corpus","status":"completed","evidence_level":"reachable_on_main","notes":"Delivered by merged PR #9; qualification remains pending.","landing":{"commit_sha":"4daeff69c36e5ff6e05c42184d8759ad87d2cf7a","pull_request":9,"changed_paths":["anchor_oracle/__init__.py","anchor_oracle/core.py","conftest.py","contracts/design-partner-commercial-evidence.schema.json","contracts/managed-execution-receipt.schema.json","contracts/qualification-cost-receipt.schema.json","contracts/qualification-receipt.schema.json","contracts/registry-snapshot.schema.json","contracts/release-evidence.schema.json","contracts/resolver-decision-receipt.schema.json","contracts/resolver-request.schema.json","contracts/resolver-response.schema.json","contracts/sandbox-case-receipt.schema.json","contracts/workload-identity-receipt.schema.json","openwiki/anchor-oracle-comparison.md","openwiki/qualification-pipeline.md","pyproject.toml","requirements.lock","scripts/anchor_oracle.py","scripts/skill_description_linter.py","skill_arena/__init__.py","skill_arena/core.py","skill_arena/skill_assets.py","skills/repo_wiki_verified/corpus.json","skills/repo_wiki_verified/manifest.json","skills/repo_wiki_verified/references/procedure.md","skills/repo_wiki_verified/skills.md","tests/fixtures/anchor_oracle/fixture_repo/data/notes.txt","tests/fixtures/anchor_oracle/fixture_repo/src/demo.py","tests/fixtures/anchor_oracle/wiki_good/architecture/overview.md","tests/fixtures/anchor_oracle/wiki_good/index.md","tests/fixtures/anchor_oracle/wiki_hollow/badfm.md","tests/fixtures/anchor_oracle/wiki_hollow/fabricated.md","tests/fixtures/anchor_oracle/wiki_hollow/missing.md","tests/fixtures/anchor_oracle/wiki_hollow/prose.md","tests/fixtures/repo_wiki_verified/public_fixture_provenance.json","tests/fixtures/repo_wiki_verified/public_fixture_subset/scripts/ablation_engine.py","tests/fixtures/repo_wiki_verified/public_fixture_subset/scripts/git_gate.py","tests/fixtures/repo_wiki_verified/public_fixture_subset/scripts/no_op_pruner.py","tests/fixtures/repo_wiki_verified/public_fixture_subset/scripts/no_ops_purger.py","tests/fixtures/repo_wiki_verified/public_fixture_subset/scripts/skill_description_linter.py","tests/fixtures/repo_wiki_verified/public_fixture_subset/scripts/sync_wiki_to_graph.py","tests/fixtures/repo_wiki_verified/public_fixture_subset/scripts/validate_commit_message.py","tests/fixtures/repo_wiki_verified/public_fixture_subset/scripts/validate_progressive_disclosure.py","tests/fixtures/repo_wiki_verified/public_fixture_subset/scripts/validate_skills_baseline.py","tests/fixtures/repo_wiki_verified/public_fixture_subset/skills/gemini_interactions/status.json","tests/test_anchor_oracle.py","tests/test_repo_wiki_verified_corpus.py"],"changed_paths_digest":"sha256:317382744003b55faf18172b00751b4544a8650d7c612a786101c7ae698aa819","test_evidence":{"source":"pull_request","commands":["python -m pytest tests","python scripts/anchor_oracle.py --selftest","python scripts/skill_description_linter.py"],"result_summary":"PR #9 reports 103 passed, 7 skipped, and one pre-existing molecular-lineage failure; anchor selftest and description linter passed.","independently_verified":false,"digest":"sha256:23d49f33f8e0ee4974db1a6e87d4aec20a7ea9769be3dc4dd240cbfcf37ac2fc"}}},{"issue_number":7,"title":"Harvest reviewed Slice 1 and Slice 2","status":"completed","evidence_level":"reachable_on_main","notes":"The public repository landing is PR #9 merge commit. The previously cited local short SHA is retained only as historical context, not completion evidence.","landing":{"commit_sha":"4daeff69c36e5ff6e05c42184d8759ad87d2cf7a","pull_request":9,"changed_paths":["anchor_oracle/__init__.py","anchor_oracle/core.py","conftest.py","contracts/design-partner-commercial-evidence.schema.json","contracts/managed-execution-receipt.schema.json","contracts/qualification-cost-receipt.schema.json","contracts/qualification-receipt.schema.json","contracts/registry-snapshot.schema.json","contracts/release-evidence.schema.json","contracts/resolver-decision-receipt.schema.json","contracts/resolver-request.schema.json","contracts/resolver-response.schema.json","contracts/sandbox-case-receipt.schema.json","contracts/workload-identity-receipt.schema.json","openwiki/anchor-oracle-comparison.md","openwiki/qualification-pipeline.md","pyproject.toml","requirements.lock","scripts/anchor_oracle.py","scripts/skill_description_linter.py","skill_arena/__init__.py","skill_arena/core.py","skill_arena/skill_assets.py","skills/repo_wiki_verified/corpus.json","skills/repo_wiki_verified/manifest.json","skills/repo_wiki_verified/references/procedure.md","skills/repo_wiki_verified/skills.md","tests/fixtures/anchor_oracle/fixture_repo/data/notes.txt","tests/fixtures/anchor_oracle/fixture_repo/src/demo.py","tests/fixtures/anchor_oracle/wiki_good/architecture/overview.md","tests/fixtures/anchor_oracle/wiki_good/index.md","tests/fixtures/anchor_oracle/wiki_hollow/badfm.md","tests/fixtures/anchor_oracle/wiki_hollow/fabricated.md","tests/fixtures/anchor_oracle/wiki_hollow/missing.md","tests/fixtures/anchor_oracle/wiki_hollow/prose.md","tests/fixtures/repo_wiki_verified/public_fixture_provenance.json","tests/fixtures/repo_wiki_verified/public_fixture_subset/scripts/ablation_engine.py","tests/fixtures/repo_wiki_verified/public_fixture_subset/scripts/git_gate.py","tests/fixtures/repo_wiki_verified/public_fixture_subset/scripts/no_op_pruner.py","tests/fixtures/repo_wiki_verified/public_fixture_subset/scripts/no_ops_purger.py","tests/fixtures/repo_wiki_verified/public_fixture_subset/scripts/skill_description_linter.py","tests/fixtures/repo_wiki_verified/public_fixture_subset/scripts/sync_wiki_to_graph.py","tests/fixtures/repo_wiki_verified/public_fixture_subset/scripts/validate_commit_message.py","tests/fixtures/repo_wiki_verified/public_fixture_subset/scripts/validate_progressive_disclosure.py","tests/fixtures/repo_wiki_verified/public_fixture_subset/scripts/validate_skills_baseline.py","tests/fixtures/repo_wiki_verified/public_fixture_subset/skills/gemini_interactions/status.json","tests/test_anchor_oracle.py","tests/test_repo_wiki_verified_corpus.py"],"changed_paths_digest":"sha